{
  "k0000": 6099,
  "k0001": 8814,
  "k0002": 5764,
  "k0003": 5560,
  "k0004": 7852,
  "k0005": 9173,
  "k0006": 3029,
  "k0007": 9713,
  "k0008": 5212,
  "k0009": 7302,
  "k0010": 8485,
  "k0011": 3035,
  "k0012": 3761,
  "k0013": 2853,
  "k0014": 6473,
  "k0015": 107,
  "k0016": 8486,
  "k0017": 5394,
  "k0018": 5127,
  "k0019": 7149,
  "k0020": 853,
  "k0021": 7078,
  "k0022": 3219,
  "k0023": 242,
  "k0024": 5353,
  "k0025": 1081,
  "k0026": 7972,
  "k0027": 7650,
  "k0028": 2872,
  "k0029": 8660,
  "k0030": 7251,
  "k0031": 4332,
  "k0033": 6712,
  "k0034": 684,
  "k0036": 1629,
  "k0038": 8924,
  "k0039": 4929,
  "k0042": 774,
  "k0045": 4849,
  "k0046": 6644,
  "k0047": 8043,
  "k0048": 7318,
  "k0052": 3828,
  "k0054": 8476,
  "k0055": 9046,
  "k0056": 6212,
  "k0064": 7602,
  "k0067": 241,
  "k0069": 2440,
  "k0071": 4575,
  "k0075": 8893,
  "k0076": 5448,
  "k0078": 4257,
  "k0079": 3219,
  "k0080": 1078,
  "k0081": 1691,
  "k0082": 5844,
  "k0086": 9732,
  "k0087": 281,
  "k0089": 6850,
  "k0094": 8612,
  "k0099": 4298,
  "k0102": 4568,
  "k0104": 2937,
  "k0105": 9294,
  "k0108": 7609,
  "k0111": 6893,
  "k0112": 2066,
  "k0113": 7540,
  "k0115": 5111,
  "k0117": 478,
  "k0118": 5252,
  "k0120": 5697,
  "k0121": 7564
}
